{
  "tool": "contract-lint",
  "version": "X.Y.Z",
  "path": "definitions.md",
  "format": "markdown",
  "numbering_resolved": null,
  "fail_on": "error",
  "ok": true,
  "exit_code": 0,
  "summary": {
    "error": 0,
    "warning": 2,
    "total": 2,
    "by_rule": {
      "unused-definition": 1,
      "double-definition": 1
    }
  },
  "findings": [
    {
      "rule": "unused-definition",
      "severity": "warning",
      "message": "defined term 'Maintenance Fee' is never used after its definition",
      "line": 5,
      "excerpt": "\"Maintenance Fee\" means the annual fee for support and updates."
    },
    {
      "rule": "double-definition",
      "severity": "warning",
      "message": "defined term 'Licensed Product' is defined 2\u00d7 (first at line 3)",
      "line": 6,
      "excerpt": "\"Licensed Product\" means the software together with its documentation."
    }
  ]
}
